{"$id":"https://orbital-dynamics.local/schemas/branch_comparison_report.v1.schema.json","$schema":"https://json-schema.org/draft/2020-12/schema","additionalProperties":true,"properties":{"assumptions":{"type":"object"},"branch_count":{"minimum":0,"type":"integer"},"model":{"const":"deterministic_strategy_branch_score_comparison","type":"string"},"model_limits":{"items":{"enum":["deterministic_branch_score_explainability_only","branch_probabilities_are_input_confidence_multipliers","no_autonomous_execution","score_terms_are_planning_heuristics"],"type":"string"},"type":"array"},"recommended_branch_id":{"pattern":"^[A-Za-z0-9][A-Za-z0-9._:@-]*$","type":"string"},"rows":{"items":{"additionalProperties":true,"properties":{"branch_station_reservation_ids":{"items":{"pattern":"^[A-Za-z0-9][A-Za-z0-9._:@-]*$","type":"string"},"type":"array"},"first_resource_pressure_starts_at_s":{"type":"number"},"quality_gate_resource_availability_reason_ids":{"items":{"type":"string"},"type":"array"},"score":{"type":"number"},"resource_projection_payload_unavailable_count":{"minimum":0,"type":"integer"},"quality_gate_source_artifact_types":{"items":{"type":"string"},"type":"array"},"first_resource_pressure_station_calendar_directions":{"items":{"type":"string"},"type":"array"},"resource_projection_availability_pressure_types":{"items":{"type":"string"},"type":"array"},"risk_types":{"items":{"type":"string"},"type":"array"},"operational_readiness_feedback_keys":{"items":{"type":"string"},"type":"array"},"branch_station_reservation_match_statuses":{"items":{"type":"string"},"type":"array"},"branch_blur_max_score":{"maximum":1.0,"minimum":0.0,"type":"number"},"branch_realized_statuses":{"items":{"type":"string"},"type":"array"},"score_delta_from_recommended":{"type":"number"},"branch_collection_ids":{"items":{"pattern":"^[A-Za-z0-9][A-Za-z0-9._:@-]*$","type":"string"},"type":"array"},"branch_instrument_ids":{"items":{"pattern":"^[A-Za-z0-9][A-Za-z0-9._:@-]*$","type":"string"},"type":"array"},"operational_readiness_source_artifact_ids":{"items":{"type":"string"},"type":"array"},"branch_required_downlink_mb":{"type":"number"},"repair_activity_score":{"type":"number"},"branch_target_ids":{"items":{"pattern":"^[A-Za-z0-9][A-Za-z0-9._:@-]*$","type":"string"},"type":"array"},"operational_readiness_gate_classifications":{"items":{"type":"string"},"type":"array"},"projected_downlink_remaining_mb":{"type":"number"},"fuel_preservation_mode":{"type":"boolean"},"payload_availability":{"type":"number"},"branch_station_reservation_statuses":{"items":{"type":"string"},"type":"array"},"branch_directions":{"items":{"type":"string"},"type":"array"},"capacity_pack_max_required_capacity_fraction":{"maximum":1.0,"minimum":0.0,"type":"number"},"quality_gate_feedback_scopes":{"items":{"type":"string"},"type":"array"},"branch_station_contention_statuses":{"items":{"type":"string"},"type":"array"},"branch_actual_downlink_completion_ratio":{"maximum":1,"minimum":0,"type":"number"},"branch_station_reserved_by":{"items":{"type":"string"},"type":"array"},"capacity_pack_statuses":{"items":{"type":"string"},"type":"array"},"first_resource_pressure_kinds":{"items":{"type":"string"},"type":"array"},"branch_missed_downlink_activity_ids":{"items":{"pattern":"^[A-Za-z0-9][A-Za-z0-9._:@-]*$","type":"string"},"type":"array"},"risk_count":{"minimum":0,"type":"integer"},"capacity_pack_group_ids":{"items":{"pattern":"^[A-Za-z0-9][A-Za-z0-9._:@-]*$","type":"string"},"type":"array"},"branch_requires_operator_review_count":{"minimum":0,"type":"integer"},"resource_risk_types":{"items":{"type":"string"},"type":"array"},"branch_image_quality_sources":{"items":{"type":"string"},"type":"array"},"branch_event_count":{"minimum":0,"type":"integer"},"repair_link_selected_capacity_adjusted_throughput_mb":{"type":"number"},"quality_gate_feedback_sources":{"items":{"type":"string"},"type":"array"},"resource_projection_peak_downlink_shortfall_mb":{"type":"number"},"capacity_pack_total_required_capacity_fraction":{"minimum":0.0,"type":"number"},"branch_objective_statuses":{"items":{"type":"string"},"type":"array"},"quality_gate_ids":{"items":{"type":"string"},"type":"array"},"branch_transition_categories":{"items":{"type":"string"},"type":"array"},"downlink_capacity_margin":{"type":"number"},"operational_readiness_required_operator_actions":{"items":{"type":"string"},"type":"array"},"operational_readiness_levels":{"items":{"type":"string"},"type":"array"},"capacity_pack_min_capacity_fraction":{"maximum":1.0,"minimum":0.0,"type":"number"},"spacecraft_availability":{"type":"number"},"quality_gate_trust_boundaries":{"items":{"type":"string"},"type":"array"},"branch_id":{"pattern":"^[A-Za-z0-9][A-Za-z0-9._:@-]*$","type":"string"},"branch_station_calendar_trust_boundary_statuses":{"items":{"type":"string"},"type":"array"},"projected_storage_overflow_mb":{"type":"number"},"resource_pressure_statuses":{"items":{"type":"string"},"type":"array"},"branch_station_availabilities":{"items":{"type":"string"},"type":"array"},"branch_product_ids":{"items":{"pattern":"^[A-Za-z0-9][A-Za-z0-9._:@-]*$","type":"string"},"type":"array"},"priority_commitment_satisfied_target_ids":{"items":{"pattern":"^[A-Za-z0-9][A-Za-z0-9._:@-]*$","type":"string"},"type":"array"},"branch_event_trust_boundary_status_counts":{"additionalProperties":{"minimum":0,"type":"integer"},"propertyNames":{"enum":["declared","missing","untrusted"]},"type":"object"},"resource_projection_peak_battery_overuse_wh":{"type":"number"},"rank":{"type":"integer"},"antenna_availability":{"type":"number"},"quality_gate_feedback_keys":{"items":{"type":"string"},"type":"array"},"resource_projection_degraded_payload_unavailable_count":{"minimum":0,"type":"integer"},"branch_required_contacts":{"type":"number"},"repair_score_term_keys":{"items":{"type":"string"},"type":"array"},"projected_power_margin":{"type":"number"},"branch_station_calendar_directions":{"items":{"type":"string"},"type":"array"},"resource_score_adjustment":{"type":"number"},"branch_station_calendar_provider_entry_ids":{"items":{"pattern":"^[A-Za-z0-9][A-Za-z0-9._:@-]*$","type":"string"},"type":"array"},"resource_projection_payload_unavailable_spacecraft_ids":{"items":{"pattern":"^[A-Za-z0-9][A-Za-z0-9._:@-]*$","type":"string"},"type":"array"},"branch_feedback_sources":{"items":{"type":"string"},"type":"array"},"branch_payload_ids":{"items":{"pattern":"^[A-Za-z0-9][A-Za-z0-9._:@-]*$","type":"string"},"type":"array"},"resource_projection_peak_storage_overflow_mb":{"type":"number"},"operational_readiness_gate_ids":{"items":{"type":"string"},"type":"array"},"candidate_activity_count":{"minimum":0,"type":"integer"},"branch_transition_reasons":{"items":{"type":"string"},"type":"array"},"branch_ground_station_ids":{"items":{"pattern":"^[A-Za-z0-9][A-Za-z0-9._:@-]*$","type":"string"},"type":"array"},"selected":{"type":"boolean"},"repair_link_actual_downlink_completion_ratio":{"maximum":1,"minimum":0,"type":"number"},"approval_status":{"enum":["auto_approvable","operator_review_required","blocked_by_policy"],"type":"string"},"quality_gate_source_artifact_ids":{"items":{"type":"string"},"type":"array"},"quality_gate_source_readiness_report_ids":{"items":{"type":"string"},"type":"array"},"branch_station_calendar_provider_ids":{"items":{"pattern":"^[A-Za-z0-9][A-Za-z0-9._:@-]*$","type":"string"},"type":"array"},"projected_downlink_shortfall_mb":{"type":"number"},"branch_image_quality_statuses":{"items":{"type":"string"},"type":"array"},"score_terms":{"additionalProperties":{"type":"number"},"type":"object"},"resource_projection_warning_count":{"minimum":0,"type":"integer"},"quality_gate_report_ids":{"items":{"type":"string"},"type":"array"},"resource_projection_antenna_unavailable_count":{"minimum":0,"type":"integer"},"priority_commitment_satisfied_target_count":{"minimum":0,"type":"integer"},"fuel_margin":{"type":"number"},"operational_readiness_feedback_scopes":{"items":{"type":"string"},"type":"array"},"id":{"pattern":"^[A-Za-z0-9][A-Za-z0-9._:@-]*$","type":"string"},"branch_planned_downlink_mb":{"type":"number"},"resource_projection_unavailable_spacecraft_ids":{"items":{"pattern":"^[A-Za-z0-9][A-Za-z0-9._:@-]*$","type":"string"},"type":"array"},"resource_projection_degraded_payload_unavailable_spacecraft_ids":{"items":{"pattern":"^[A-Za-z0-9][A-Za-z0-9._:@-]*$","type":"string"},"type":"array"},"branch_source_objective_statuses":{"items":{"type":"string"},"type":"array"},"priority_commitment_required_target_ids":{"items":{"pattern":"^[A-Za-z0-9][A-Za-z0-9._:@-]*$","type":"string"},"type":"array"},"first_resource_pressure_ground_station_id":{"pattern":"^[A-Za-z0-9][A-Za-z0-9._:@-]*$","type":"string"},"quality_gate_import_classifications":{"items":{"type":"string"},"type":"array"},"first_resource_pressure_activity_type":{"type":"string"},"repair_link_actual_downlink_shortfall_mb":{"type":"number"},"branch_max_latency_s":{"type":"number"},"projected_battery_overuse_wh":{"type":"number"},"branch_requires_operator_review":{"type":"boolean"},"branch_station_calendar_statuses":{"items":{"type":"string"},"type":"array"},"first_resource_pressure_direction":{"type":"string"},"quality_gate_required_operator_actions":{"items":{"type":"string"},"type":"array"},"downlink_completion_planned_contacts":{"minimum":0,"type":"integer"},"resource_projection_peak_unused_downlink_capacity_mb":{"type":"number"},"operational_readiness_gate_statuses":{"items":{"type":"string"},"type":"array"},"branch_feedback_scopes":{"items":{"type":"string"},"type":"array"},"first_resource_pressure_station_calendar_entry_id":{"pattern":"^[A-Za-z0-9][A-Za-z0-9._:@-]*$","type":"string"},"branch_cloud_cover_max_fraction":{"maximum":1.0,"minimum":0.0,"type":"number"},"operational_readiness_statuses":{"items":{"type":"string"},"type":"array"},"branch_station_calendar_entry_ids":{"items":{"pattern":"^[A-Za-z0-9][A-Za-z0-9._:@-]*$","type":"string"},"type":"array"},"branch_transition_types":{"items":{"type":"string"},"type":"array"},"first_resource_pressure_station_calendar_provider_entry_id":{"pattern":"^[A-Za-z0-9][A-Za-z0-9._:@-]*$","type":"string"},"resource_projection_spacecraft_count":{"minimum":0,"type":"integer"},"branch_objective_types":{"items":{"type":"string"},"type":"array"},"observation_success_factor":{"maximum":1.0,"minimum":0.0,"type":"number"},"repair_score_term_count":{"minimum":0,"type":"integer"},"storage_limited_downlinked_mb":{"type":"number"},"operational_readiness_trust_boundaries":{"items":{"type":"string"},"type":"array"},"branch_probability":{"maximum":1.0,"minimum":0.0,"type":"number"},"repair_link_selected_contact_count":{"minimum":0,"type":"integer"},"quality_gate_statuses":{"items":{"type":"string"},"type":"array"},"repair_link_actual_downlink_requirement_status":{"type":"string"},"storage_margin":{"type":"number"},"repair_schedule_churn_penalty":{"type":"number"},"resource_projection_unavailable_spacecraft_count":{"minimum":0,"type":"integer"},"operational_readiness_import_classifications":{"items":{"type":"string"},"type":"array"},"quality_gate_pressure_statuses":{"items":{"type":"string"},"type":"array"},"operational_readiness_source_artifact_types":{"items":{"type":"string"},"type":"array"},"unused_downlink_capacity_mb":{"type":"number"},"raw_score":{"type":"number"},"branch_scenario_ids":{"items":{"pattern":"^[A-Za-z0-9][A-Za-z0-9._:@-]*$","type":"string"},"type":"array"},"capacity_pack_required_capacity_sources":{"items":{"type":"string"},"type":"array"},"capacity_pack_max_used_fraction":{"maximum":1.0,"minimum":0.0,"type":"number"},"first_resource_pressure_activity_id":{"pattern":"^[A-Za-z0-9][A-Za-z0-9._:@-]*$","type":"string"},"feedback_risk_types":{"items":{"type":"string"},"type":"array"},"feedback_score_adjustment":{"type":"number"},"downlink_completion_required_contacts":{"minimum":0,"type":"integer"},"coverage_observed_target_count":{"minimum":0,"type":"integer"},"branch_planned_latency_s":{"type":"number"},"repair_link_actual_throughput_mb":{"type":"number"},"quality_gate_classifications":{"items":{"type":"string"},"type":"array"},"projected_downlink_margin":{"type":"number"},"priority_commitment_missed_target_ids":{"items":{"pattern":"^[A-Za-z0-9][A-Za-z0-9._:@-]*$","type":"string"},"type":"array"},"approval_requirement_count":{"minimum":0,"type":"integer"},"expected_score":{"type":"number"},"combined_source_branch_ids":{"items":{"pattern":"^[A-Za-z0-9][A-Za-z0-9._:@-]*$","type":"string"},"type":"array"},"resource_projection_flow_count":{"minimum":0,"type":"integer"},"operational_readiness_report_ids":{"items":{"type":"string"},"type":"array"},"projected_storage_margin":{"type":"number"},"repair_schedule_move_penalty":{"type":"number"},"branch_planned_contacts":{"type":"number"},"first_resource_pressure_kind":{"type":"string"},"repair_link_selected_estimated_throughput_mb":{"type":"number"},"resource_projection_antenna_unavailable_spacecraft_ids":{"items":{"pattern":"^[A-Za-z0-9][A-Za-z0-9._:@-]*$","type":"string"},"type":"array"},"quality_gate_unavailable_resource_reason_ids":{"items":{"type":"string"},"type":"array"},"downlink_completion_planned_downlink_mb":{"type":"number"},"projected_storage_remaining_mb":{"type":"number"},"branch_contact_results":{"items":{"type":"string"},"type":"array"},"quality_gate_readiness_levels":{"items":{"type":"string"},"type":"array"},"revisit_count":{"minimum":0,"type":"integer"},"branch_image_quality_min_score":{"maximum":1.0,"minimum":0.0,"type":"number"},"priority_commitment_missed_target_count":{"minimum":0,"type":"integer"},"branch_objective_ids":{"items":{"pattern":"^[A-Za-z0-9][A-Za-z0-9._:@-]*$","type":"string"},"type":"array"},"first_resource_pressure_station_calendar_provider_id":{"pattern":"^[A-Za-z0-9][A-Za-z0-9._:@-]*$","type":"string"},"resource_pressure_types":{"items":{"type":"string"},"type":"array"},"downlink_completion_ratio":{"maximum":1.0,"minimum":0.0,"type":"number"},"priority_commitment_required_target_count":{"minimum":0,"type":"integer"},"repair_delta_count":{"minimum":0,"type":"integer"},"branch_source_activity_ids":{"items":{"pattern":"^[A-Za-z0-9][A-Za-z0-9._:@-]*$","type":"string"},"type":"array"},"high_risk_types":{"items":{"type":"string"},"type":"array"},"repair_score":{"type":"number"},"repair_link_contact_count":{"minimum":0,"type":"integer"},"operational_readiness_feedback_sources":{"items":{"type":"string"},"type":"array"},"branch_event_types":{"items":{"type":"string"},"type":"array"}},"required":["id","rank","branch_id","score","score_delta_from_recommended","selected","approval_status","risk_count","approval_requirement_count","score_terms"],"type":"object"},"type":"array"},"schema_contract":{"const":"branch_comparison_report.v1","description":"Stable executable contract identifier","type":"string"},"source":{"const":"campaign_strategy.branches","type":"string"}},"required":["schema_contract","model","source","branch_count","recommended_branch_id","rows","assumptions"],"title":"OrbitalDynamics branch_comparison_report.v1","type":"object","x-orbital-dynamics":{"artifact_family":"branch_comparison_report","compatibility_policy":{"breaking_change_action":"mint a new schema_contract name or increment the artifact schema_version before publishing","breaking_changes":["remove_required_fields","change_required_field_type","change_schema_contract_identifier","change_schema_version_const","change_required_field_semantics"],"compatible_changes":["add_optional_fields","add_optional_nested_contracts","tighten_executable_semantic_validation_without_changing_exported_required_fields"],"policy_version":1,"validation_mode":"top_level_compatibility_export"},"compatibility_policy_version":1,"executable_contract":true,"identity_policy":{"breaking_changes":["change_existing_public_identifier_for_the_same_semantic_entity","emit_blank_identifier","emit_identifier_with_whitespace"],"compatible_changes":["add_optional_identifier_fields","add_more_specific_semantic_source_metadata_without_changing_existing_ids"],"description":"Public artifact identifiers are non-empty machine identifiers without whitespace.","generated_id_scopes":[{"identity_fields":["scenario_id","type","source_window_id","target_id","ground_station_id"],"ordering":["result_event_type","scenario_id","source_window_id","starts_at_s"],"scope":"candidate_refresh.v1.candidate_activities"},{"generated_id_field":"id","identity_fields":["type","scenario_id","target_id","ground_station_id","starts_at_s","ends_at_s"],"ordering":["type","scenario_id","target_id","ground_station_id","starts_at_s","id"],"scope":"candidate_refresh.v1.refreshed_windows.generated_window_id","semantic_invariants":["source_record_order_must_not_change_generated_window_id","canonical_source_event_sort_key_must_drive_window_index","same_semantic_source_window_must_keep_generated_window_id"]},{"identity_fields":["spacecraft_id","scenario_id","epoch.seconds_since_j2000"],"ordering":["spacecraft_id","scenario_id","epoch.seconds_since_j2000"],"scope":"accepted_planning_state.v1.spacecraft_states"},{"generated_id_field":"id","identity_fields":["resource_scope","ground_station_id","spacecraft_id","starts_at_s","ends_at_s","contact_ids"],"ordering":["resource_scope","ground_station_id","spacecraft_id","starts_at_s","id"],"scope":"contact_contention_report.v1.conflict_groups.generated_group_id","semantic_invariants":["source_record_order_must_not_change_generated_group_id","canonical_contact_sort_key_must_drive_conflict_group_index","same_semantic_contention_group_must_keep_generated_group_id"]},{"generated_id_field":"group_id","identity_fields":["group_id","resource_scope","ground_station_id","spacecraft_id","starts_at_s","selected_contact_id","deferred_contact_ids"],"ordering":["resource_scope","ground_station_id","spacecraft_id","starts_at_s","group_id"],"scope":"contact_contention_resolution_report.v1.recommendations.generated_group_id","semantic_invariants":["contention_group_id_must_flow_to_recommendation_group_id","source_record_order_must_not_change_recommendation_group_id","resolution_ordering_must_not_change_group_identity"]},{"explicit_id_fields":["route_id","id","data_path_id"],"identity_fields":["source_spacecraft_id","relay_chain_spacecraft_ids","ground_station_id","ground_downlink_contact_id","latency_s","latency_limit_s","product_ids","collection_ids"],"ordering":["source_spacecraft_id","ground_downlink_contact_id","semantic_route_fingerprint"],"scope":"relay_data_path_summary.v1.rows.generated_route_id","semantic_invariants":["source_record_order_must_not_change_generated_route_id","semantic_route_evidence_changes_must_change_generated_route_id","explicit_route_id_takes_precedence_over_generated_route_id"]},{"generated_id_field":"publication_id","identity_fields":["publication_sequence","source_artifact_id","supersedes_artifact_ids"],"ordering":["publication_sequence","source_artifact_id","supersedes_artifact_ids"],"scope":"timeline_publication_summary.v1.publication_id","semantic_invariants":["source_record_order_must_not_change_publication_id","same_publication_sequence_and_artifact_lineage_must_keep_publication_id","publication_id_serializes_declared_artifact_lineage"]}],"policy_version":1,"semantic_invariants":["source_record_order_must_not_change_generated_identity","semantic_source_identity_must_remain_stable_across_manifest_export","scenario_and_activity_identity_must_not_depend_on_wall_clock_time"],"stable_id_pattern":"^[A-Za-z0-9][A-Za-z0-9._:@-]*$"},"identity_policy_version":1,"nested_contract_definition_scope":"direct_declared_contracts","nested_contracts":[],"schema_contract":"branch_comparison_report.v1","schema_version":1,"validation_mode":"top_level_compatibility_export"}}
