{"assumptions":{"blocked_branches_remain_visible":true,"branch_order":"score_descending_then_branch_id","branch_probability":"independent branch likelihood or confidence multiplier in [0,1]","expected_score":"raw_score_times_branch_probability_times_probability_weight","raw_score":"score_before_branch_probability_multiplier","score":"probability_weighted_expected_score","score_delta_from_recommended":"row_score_minus_recommended_branch_score"},"branch_count":13,"model":"deterministic_strategy_branch_score_comparison","model_limits":["deterministic_branch_score_explainability_only","branch_probabilities_are_input_confidence_multipliers","no_autonomous_execution","score_terms_are_planning_heuristics"],"recommended_branch_id":"derived_urgent_target_target_hot","rows":[{"score":2835.3981832107565,"score_delta_from_recommended":0.0,"repair_activity_score":1417.2731832107565,"fuel_preservation_mode":false,"payload_availability":0.5,"risk_count":7,"resource_risk_types":["downlink_capacity_low","fuel_margin_low","payload_availability_low","spacecraft_availability_low","storage_margin_low"],"repair_link_selected_capacity_adjusted_throughput_mb":0,"downlink_capacity_margin":0.62,"spacecraft_availability":0.5,"branch_id":"derived_urgent_target_target_hot","priority_commitment_satisfied_target_ids":["target_a"],"rank":1,"antenna_availability":1.0,"repair_score_term_keys":["activity_score","schedule_churn_penalty","schedule_move_penalty"],"resource_score_adjustment":-124.0,"candidate_activity_count":1,"selected":true,"approval_status":"operator_review_required","score_terms":{"approval_load_penalty":-20.0,"asset_balance_score":10.0,"branch_probability":1.0,"coverage_score":50.0,"downlink_completion_score":0.0,"expected_score":2835.3981832107565,"feedback_adjustment_score":-8.999999999999996,"fuel_preservation_score":1.125,"latency_penalty":-0.0,"mission_value_score":3577.2731832107565,"priority_commitment_score":50.0,"raw_score":2835.3981832107565,"resource_score":-124.0,"revisit_score":0.0,"risk_penalty":-700.0,"schedule_stability_penalty":-0.0},"resource_projection_warning_count":2,"priority_commitment_satisfied_target_count":1,"fuel_margin":0.18,"id":"branch_comparison:derived_urgent_target_target_hot","priority_commitment_required_target_ids":["target_a"],"downlink_completion_planned_contacts":0,"resource_projection_spacecraft_count":1,"observation_success_factor":0.8200000000000001,"repair_score_term_count":3,"storage_limited_downlinked_mb":0.0,"branch_probability":1.0,"repair_link_selected_contact_count":0,"storage_margin":0.16,"repair_schedule_churn_penalty":-0.0,"unused_downlink_capacity_mb":0.0,"raw_score":2835.3981832107565,"feedback_risk_types":[],"feedback_score_adjustment":-8.999999999999996,"downlink_completion_required_contacts":2,"coverage_observed_target_count":2,"projected_downlink_margin":0.62,"priority_commitment_missed_target_ids":[],"approval_requirement_count":1,"expected_score":2835.3981832107565,"resource_projection_flow_count":2,"projected_storage_margin":0.16,"repair_schedule_move_penalty":-0.0,"repair_link_selected_estimated_throughput_mb":0,"downlink_completion_planned_downlink_mb":0,"revisit_count":0,"priority_commitment_missed_target_count":0,"downlink_completion_ratio":0.0,"priority_commitment_required_target_count":1,"repair_delta_count":1,"repair_score":1417.2731832107565,"repair_link_contact_count":0},{"score":2409.3981832107565,"score_delta_from_recommended":-426.0,"repair_activity_score":1417.2731832107565,"fuel_preservation_mode":false,"payload_availability":0.5,"risk_count":7,"resource_risk_types":["downlink_capacity_low","fuel_margin_low","payload_availability_low","spacecraft_availability_low","storage_margin_low"],"repair_link_selected_capacity_adjusted_throughput_mb":0,"downlink_capacity_margin":0.62,"spacecraft_availability":0.5,"branch_id":"derived_target_revisit_target_hot","priority_commitment_satisfied_target_ids":["target_a"],"rank":2,"antenna_availability":1.0,"repair_score_term_keys":["activity_score","schedule_churn_penalty","schedule_move_penalty"],"resource_score_adjustment":-124.0,"candidate_activity_count":2,"selected":false,"approval_status":"operator_review_required","score_terms":{"approval_load_penalty":-40.0,"asset_balance_score":10.0,"branch_probability":1.0,"coverage_score":50.0,"downlink_completion_score":0.0,"expected_score":2409.3981832107565,"feedback_adjustment_score":-9.999999999999993,"fuel_preservation_score":1.125,"latency_penalty":-0.0,"mission_value_score":3167.2731832107565,"priority_commitment_score":50.0,"raw_score":2409.3981832107565,"resource_score":-124.0,"revisit_score":5.0,"risk_penalty":-700.0,"schedule_stability_penalty":-0.0},"resource_projection_warning_count":2,"priority_commitment_satisfied_target_count":1,"fuel_margin":0.18,"id":"branch_comparison:derived_target_revisit_target_hot","priority_commitment_required_target_ids":["target_a"],"downlink_completion_planned_contacts":0,"resource_projection_spacecraft_count":1,"observation_success_factor":0.8000000000000002,"repair_score_term_count":3,"storage_limited_downlinked_mb":0.0,"branch_probability":1.0,"repair_link_selected_contact_count":0,"storage_margin":0.16,"repair_schedule_churn_penalty":-0.0,"unused_downlink_capacity_mb":0.0,"raw_score":2409.3981832107565,"feedback_risk_types":[],"feedback_score_adjustment":-9.999999999999993,"downlink_completion_required_contacts":2,"coverage_observed_target_count":2,"projected_downlink_margin":0.62,"priority_commitment_missed_target_ids":[],"approval_requirement_count":2,"expected_score":2409.3981832107565,"resource_projection_flow_count":3,"projected_storage_margin":0.16,"repair_schedule_move_penalty":-0.0,"repair_link_selected_estimated_throughput_mb":0,"downlink_completion_planned_downlink_mb":0,"revisit_count":1,"priority_commitment_missed_target_count":0,"downlink_completion_ratio":0.0,"priority_commitment_required_target_count":1,"repair_delta_count":1,"repair_score":1417.2731832107565,"repair_link_contact_count":0},{"score":1312.7731832107565,"score_delta_from_recommended":-1522.625,"repair_activity_score":1417.2731832107565,"fuel_preservation_mode":true,"payload_availability":0.5,"risk_count":18,"resource_risk_types":["downlink_capacity_low","fuel_margin_low","payload_availability_low","spacecraft_availability_low","storage_margin_low"],"repair_link_selected_capacity_adjusted_throughput_mb":0,"downlink_capacity_margin":0.62,"spacecraft_availability":0.5,"branch_id":"derived_combined_mission_state","priority_commitment_satisfied_target_ids":["target_a"],"rank":3,"antenna_availability":1.0,"repair_score_term_keys":["activity_score","schedule_churn_penalty","schedule_move_penalty"],"resource_score_adjustment":-124.0,"candidate_activity_count":2,"selected":false,"approval_status":"operator_review_required","score_terms":{"approval_load_penalty":-40.0,"asset_balance_score":10.0,"branch_probability":1.0,"coverage_score":50.0,"downlink_completion_score":0.0,"expected_score":1312.7731832107565,"feedback_adjustment_score":-9.999999999999993,"fuel_preservation_score":4.5,"latency_penalty":-0.0,"mission_value_score":3167.2731832107565,"priority_commitment_score":50.0,"raw_score":1312.7731832107565,"resource_score":-124.0,"revisit_score":5.0,"risk_penalty":-1.8e3,"schedule_stability_penalty":-0.0},"resource_projection_warning_count":2,"priority_commitment_satisfied_target_count":1,"fuel_margin":0.18,"id":"branch_comparison:derived_combined_mission_state","priority_commitment_required_target_ids":["target_a"],"downlink_completion_planned_contacts":0,"resource_projection_spacecraft_count":2,"observation_success_factor":0.8000000000000002,"repair_score_term_count":3,"storage_limited_downlinked_mb":0.0,"branch_probability":1.0,"repair_link_selected_contact_count":0,"storage_margin":0.16,"repair_schedule_churn_penalty":-0.0,"unused_downlink_capacity_mb":0.0,"raw_score":1312.7731832107565,"feedback_risk_types":[],"feedback_score_adjustment":-9.999999999999993,"downlink_completion_required_contacts":2,"coverage_observed_target_count":2,"projected_downlink_margin":0.62,"priority_commitment_missed_target_ids":[],"approval_requirement_count":2,"expected_score":1312.7731832107565,"resource_projection_flow_count":3,"projected_storage_margin":0.16,"repair_schedule_move_penalty":-0.0,"repair_link_selected_estimated_throughput_mb":0,"downlink_completion_planned_downlink_mb":0,"revisit_count":1,"priority_commitment_missed_target_count":0,"downlink_completion_ratio":0.0,"priority_commitment_required_target_count":1,"repair_delta_count":1,"repair_score":1417.2731832107565,"repair_link_contact_count":0},{"score":673.3981832107565,"score_delta_from_recommended":-2162.0,"repair_activity_score":1417.2731832107565,"fuel_preservation_mode":false,"payload_availability":0.5,"risk_count":7,"resource_risk_types":["downlink_capacity_low","fuel_margin_low","payload_availability_low","spacecraft_availability_low","storage_margin_low"],"repair_link_selected_capacity_adjusted_throughput_mb":0,"downlink_capacity_margin":0.62,"spacecraft_availability":0.5,"branch_id":"derived_contact_success_feedback","priority_commitment_satisfied_target_ids":["target_a"],"rank":4,"antenna_availability":1.0,"repair_score_term_keys":["activity_score","schedule_churn_penalty","schedule_move_penalty"],"resource_score_adjustment":-124.0,"candidate_activity_count":0,"selected":false,"approval_status":"blocked_by_policy","score_terms":{"approval_load_penalty":0.0,"asset_balance_score":10.0,"branch_probability":1.0,"coverage_score":25.0,"downlink_completion_score":0.0,"expected_score":673.3981832107565,"feedback_adjustment_score":-6.0,"fuel_preservation_score":1.125,"latency_penalty":-0.0,"mission_value_score":1417.2731832107565,"priority_commitment_score":50.0,"raw_score":673.3981832107565,"resource_score":-124.0,"revisit_score":0.0,"risk_penalty":-700.0,"schedule_stability_penalty":-0.0},"resource_projection_warning_count":2,"priority_commitment_satisfied_target_count":1,"fuel_margin":0.18,"id":"branch_